"id","agid","title","timestamp","author","author_primary","subject","source","journal","abstract","date","publication_year","publication_year_rev","issn","type","issue","volume","startpage","endpage","pageoffset","page","doi_url","doi","text_availability","language","chorus","pmid","pmid_url","pmcid","pmcid_url","files_ss"
"6800215","6800215","The association of Equine Parvovirus-Hepatitis (EqPV-H) with cases of non-biologic-associated Theiler’s disease on a farm in Ontario, Canada","2021-09-14T04:20:14Z","c(""Baird, John"", ""Tegtmeyer, Birthe"", ""Arroyo, Luis"", ""Stang, Alexander"", ""Brüggemann, Yannick"", ""Hazlett, Murray"", ""Steinmann, Eike"")","Baird, John","c(""DNA"", ""West Nile virus"", ""autumn"", ""blood serum"", ""encephalopathy"", ""farms"", ""histopathology"", ""horses"", ""inactivated vaccines"", ""liver diseases"", ""necropsy"", ""necrosis"", ""phylogeny"", ""quantitative polymerase chain reaction"", ""rabies"", ""signs and symptoms (animals and humans)"", ""summer"", ""tetanus"", ""viral load"", ""Ontario"")","2020 v.242","Veterinary microbiology","Theiler’s disease was confirmed within a group horses located on a farm in southwestern Ontario during the summer and autumn of 2005. Five sudden deaths occurred between 3 July and 21 August, 2005, none of which were necropsied, however two of the horses showed clinical signs compatible with hepatic encephalopathy prior to death. No horse on the farm had received a biologic product of equine blood origin in the preceding six months. The only biologics used on the property were the administration of killed vaccines for rabies, tetanus and West Nile Virus to all horses 30 days prior to the onset of the first sudden death. Between 22 August, 2005 and 21 October, 2005, a further four horses died suddenly or were euthanized with all having a confirmed histopathologic diagnosis of acute hepatic necrosis. Serum was collected from all horses on the farm on 30 September, 2005 and this was repeated on 29 October, 2005. Equine parvovirus-hepatitis (EqPV-H) DNA was detected by quantitative-PCR in the serum of 61.8% (34/55) of the horses on the farm on either one or both sampling dates with viral loads ranging from <3.75 × 10³ copies/mL to 3.64 × 10⁷ copies/mL. EqPV-H DNA was present in serum samples of three horses with a confirmed diagnosis of Theiler’s disease, five horses with subclinical liver disease, and in clinically normal in-contact horses. Subsequent phylogenetic analysis based on partial NS1 of EqPV-H revealed not only high similarity on nucleotide level within the sequenced samples but also within other previously published sequences.","2020-03","2020","7980-2020","0378-1135","article",NA,"v. 242","108575",NA,NA,NA,"https://dx.doi.org/10.1016/j.vetmic.2019.108575","10.1016/j.vetmic.2019.108575","Citation in PubAg","",NA,NA,NA,NA,NA,"NULL"
"6631673","6631673","Intruder identity alters the response of territorial damselfish protecting algal farms","2021-09-14T01:20:24Z","Irving, Andrew D.","Irving, Andrew D.","c(""Echinometra"", ""algae"", ""carnivores"", ""coral reefs"", ""corals"", ""defensive behavior"", ""extrusion"", ""farms"", ""herbivorous fish"", ""rocks"", ""territoriality"", ""New Caledonia"")","2019 v.102 no.10","Environmental biology of fishes","Herbivorous damselfish that cultivate algal farms frequently exhibit aggressive territorial behaviour to defend their investment from intruders, particularly against other herbivorous fish and invertebrates. On a coastal coral reef in New Caledonia, the response of the damselfish Hemiglyphidodon plagiometopon to intruders of varying type and level of threat to their algal farm was tested. Responses to live and dead coral fragments, carnivorous whelks, shells, and rocks varied from no response to biting and extrusion from farms. Damselfish elicited the strongest defensive response to the herbivorous sea urchin Echinometra mathaei, rapidly attacking the urchin by biting and lifting it from farms, before extruding it up to 3.5 m away. H. plagiometopon responded in a similar manner to dead urchins (no threat of herbivory) as to live urchins, but typically did not extrude them as far. Ultimately, damselfish responded to intruders in a manner largely consistent with the level of threat posed to their algal farm, with the similar response between live and dead urchins suggesting such strong defensive behaviours may be combination of ‘hard-wired’ and learned behaviours in reaction to the level of realised threat.","2019-10","2019","7981-2019","0378-1909","article","no. 10","v. 102","1281","1289","8","pp. 1281-1289","http://dx.doi.org/10.1007/s10641-019-00906-2","10.1007/s10641-019-00906-2","Citation in PubAg","",NA,NA,NA,NA,NA,"NULL"
"7231431","7231431","Using farmer observations for animal health syndromic surveillance: Participation and performance of an online enhanced passive surveillance system","2021-09-14T07:29:49Z","c(""Pfeiffer, Caitlin"", ""Stevenson, Mark"", ""Firestone, Simon"", ""Larsen, John"", ""Campbell, Angus"")","Pfeiffer, Caitlin","c("""", ""animal health"", ""disease prevention"", ""etiology"", ""farmers"", ""farms"", ""monitoring"", ""regression analysis"", ""sheep"", ""systems engineering"", ""veterinary medicine"")","2021 v.188","Preventive veterinary medicine","The challenge of animal health surveillance is to provide the information necessary to appropriately inform disease prevention and control activities within the constraints of available resources. Syndromic surveillance of farmers’ disease observations can improve animal health data capture from extensive livestock farming systems, especially where data are not otherwise being systematically collected or when data on confirmed aetiological diagnoses are unavailable at the disease level. As it is rarely feasible to recruit a truly random sample of farmers to provide observational reports, directing farmer sampling to align with the surveillance objectives is a reasonable and practical approach. As long as potential bias is recognised and managed, farmers who will report reliably can be desirable participants in a surveillance system. Thus, one early objective of a surveillance program should be to identify characteristics associated with reporting behaviour. Knowledge of the demographic and managerial characteristics of good reporters can inform efforts to recruit additional farms into the system or aid understanding of potential bias of system reports.We describe the operation of a farmer syndromic surveillance system in Victoria, Australia, over its first two years from 2014 to 2016. Survival analysis and classification and regression tree analysis were used to identify farm level factors associated with ‘reliable’ participation (low non-response rates in longitudinal reporting). Response rate and timeliness were not associated with whether farmers had disease to report, or with different months of the year. Farmers keeping only sheep were the most reliable and timely respondents. Farmers < 43 years of age had lower response rates than older farmers. Farmers with veterinary qualifications and those working full-time on-farm provided less timely reports than other educational backgrounds and farmers who worked part-time on-farm. These analyses provide a starting point to guide recruitment of participants for surveillance of farmers’ observations using syndromic surveillance, and provide examples of strengths and weaknesses of syndromic surveillance systems for extensively-managed livestock. Once farm characteristics associated with reliable participation are known, they can be incorporated into surveillance system design in accordance with the objectives of the system.","2021-03","2021","7979-2021","0167-5877","article",NA,"v. 188","105262",NA,NA,NA,"https://dx.doi.org/10.1016/j.prevetmed.2021.105262","10.1016/j.prevetmed.2021.105262","Citation in PubAg","",NA,NA,NA,NA,NA,"NULL"
"6332840","6332840","A modelling approach for offshore wind farm feasibility with respect to ecosystem-based marine spatial planning","2021-09-14T08:13:20Z","c(""Pınarbaşı, Kemal"", ""Galparsoro, Ibon"", ""Depellegrin, Daniel"", ""Bald, Juan"", ""Pérez-Morán, Germán"", ""Borja, Ángel"")","Pınarbaşı, Kemal","c(""Bayesian theory"", ""case studies"", ""international policy and programs"", ""models"", ""planning"", ""wind"", ""wind farms"", ""wind power"")","2019 v.667","The Science of the total environment","Demand for renewable energy is increasing steadily and regulated by national and international policies. Offshore wind energy sector has been clearly the fastest in its development among other options, and development of new wind farms requires large ocean space. Therefore, there is a need of efficient spatial planning process, including the site selection constrained by technical (wind resource, coastal distance, seafloor) and environmental (impacts) factors and competence of uses. We present a novel approach, using Bayesian Belief Networks (BBN), for an integrated spatially explicit site feasibility identification for offshore wind farms. Our objectives are to: (i) develop a spatially explicit model that integrates the technical, economic, environmental and social dimensions; (ii) operationalize the BBN model; (iii) implement the model at local (Basque Country) and regional (North East Atlantic and Western Mediterranean), and (iv) develop and analyse future scenarios for wind farm installation in a local case study. Results demonstrated a total of 1% (23 km2) of moderate feasibility areas in local scaled analysis, compared to 4% of (21,600 km2) very high, and 5% (30,000 km2) of high feasibility in larger scale analysis. The main challenges were data availability and discretization when trying to expand the model from local to regional level. The use of BBN models to determine the feasibility of offshore wind farm areas has been demonstrated adequate and possible, both at local and regional scales, allowing managers to take management decisions regarding marine spatial planning when including different activities, environmental problems and technological constraints.","2019-06-01","2019","7981-2019","0048-9697","article",NA,"v. 667","306","317","11","pp. 306-317","https://dx.doi.org/10.1016/j.scitotenv.2019.02.268","10.1016/j.scitotenv.2019.02.268","Citation in PubAg","",NA,NA,NA,NA,NA,"NULL"
"6856964","6856964","Electronic feed stations for feeding concentrates to pregnant ewes on commercial sheep farms","2021-09-14T05:20:18Z","c(""Bøe, Knut Egil"", ""Homme, Tor Gunnarson"", ""Jørgensen, Grete Helen Meisfjord"")","Bøe, Knut Egil","c(""commercial farms"", ""ewes"", ""farm numbers"", ""farming systems"", ""feed concentrates"", ""gates"")","2018 v.68 no.4","Acta agriculturæ Scandinavica","The aim of this study was to investigate the use and capacity of electronic feed stations (EFS) on commercial sheep farms. The study was conducted on four commercial farms and the numbers of pregnant ewes per EFS were 36, 70, 72 and 80, respectively. Each farm was visited once and behavioural observations were carried out. In addition the date and time for both entering and leaving the EFS and the amount of concentrates dispensed at each visit for extracted. The vast majority of the ewes used the EFS regularly. The number of rewarded visits per ewe per day varied from 3.2 to 5.9, whereas the number of unrewarded visits ranged from 6.0 to 21.5 per ewe per day. We conclude that feeding concentrates to groups of pregnant ewes in EFS function satisfactory, but the design of the entrance and exit gate still have to be improved considerably.","2018-10-02","2018","7982-2018","1651-1972","article","no. 4","v. 68","202","206","4","pp. 202-206","http://dx.doi.org/10.1080/09064702.2019.1692898","10.1080/09064702.2019.1692898","Citation in PubAg","",NA,NA,NA,NA,NA,"NULL"
"7112253","7112253","Prevalence and characterisation of class 1 and 2 integrons in multi-drug resistant Staphylococcus aureus isolates from pig farms in Chongqing, China","2021-09-14T05:10:22Z","c(""Ye, Chao"", ""Hou, Fengqing"", ""Xu, Dongyi"", ""Huang, Qingyuan"", ""Chen, Xia"", ""Zeng, Zheng"", ""Peng, Yuanyi"", ""Fang, Rendong"")","Ye, Chao","c(""DNA"", ""antibiotic resistance"", ""bacteria"", ""chemical elements"", ""farms"", ""information"", ""methicillin"", ""methicillin-resistant Staphylococcus aureus"", ""multiple drug resistance"", ""prevalence"", ""public health"", ""resistance genes"", ""spectinomycin"", ""strains"", ""streptomycin"", ""swine"", ""trimethoprim"", ""veterinary medicine"", ""China"")","2020 v.64 no.3","Journal of Veterinary Research","Integrons are mobile DNA elements that allow for acquisition and dissemination of antibiotic-resistance genes among pig farm-derived bacteria. Limited information is available on integrons of Staphylococcus aureus from pig farms. The aim of this study was to characterise and investigate the prevalence of class 1 and 2 integrons in multi-drug resistant (MDR) S. aureus isolates from pig farms. A total of 724 swabs were collected from 12 pig farms in Chongqing, China, and examined by conventional microbial and molecular methods. In total, 68 isolates were S. aureus, 57 of which were methicillin resistant (MRSA). All 68 isolates were MDR strains and carried integrons, of which 88.2% (60/68) harboured both class 1 and 2. In addition, 85.3% (58/68) of the class 2 integron-positive isolates carried the β-lactam resistance gene (blaTEM₋₁), and 66.7% (40/60) of the class 1 integron–positive isolates carried the aadA1c, aadA1 or dfrA1 gene for respective streptomycin and spectinomycin or trimethoprim resistance. Class 1 and 2 integrons are common among the pig farm-derived S. aureus isolates. On account of their significance for public health, the prevalence of the integrons and their associated resistance genes in pig farm-derived S. aureus isolates should be paid special attention.","2020-09-16","2020","7980-2020","2450-8608","article","no. 3","v. 64","381","386","5","pp. 381-386","https://dx.doi.org/10.2478/jvetres-2020-0061","10.2478/jvetres-2020-0061","Citation in PubAg","",NA,NA,NA,NA,NA,"NULL"
"7330661","7330661","A farming systems approach to linking agricultural policies with biodiversity and ecosystem services","2021-09-14T09:48:07Z","c(""Santos, José L"", ""Moreira, Francisco"", ""Ribeiro, Paulo F"", ""Canadas, Maria J"", ""Novais, Ana"", ""Lomba, Angela"")","Santos, José L","c(""agricultural policy"", ""biodiversity"", ""cost effectiveness"", ""ecosystems"", ""environment"", ""farm management"", ""information sources"", ""Europe"")","2021 v.19 no.3","Frontiers in ecology and the environment","Many countries are reshaping their agricultural policies to better enhance biodiversity and ecosystem services (BES) in farmlands, but measuring the effectiveness of policy instruments in BES delivery is challenging. Using the European Agricultural Policy as an example, we propose the application of a farming systems (FS) approach as a cost‐effective tool for linking policy design and expected BES outcomes. On the basis of available data from subsidy payment agencies, such an approach can identify groups of farms that share similar management practices as well as the associations between FS and corresponding BES potential, and improve modeled outputs of farm management responses to policies and other drivers of change. We describe how this relatively unexplored source of information can help to support applied ecological research and relevant policy, and call for these data to be made available across Europe and elsewhere.","2021-04","2021","7979-2021","1540-9295","article","no. 3","v. 19","168","175","7","pp. 168-175","http://dx.doi.org/10.1002/fee.2292","10.1002/fee.2292","Citation in PubAg","",NA,NA,NA,NA,NA,"NULL"
"7372838","7372838","Benthic Flora of Coral Reefs in Heavily Nutrient-Polluted Areas of Sanya Bay (Hainan Island, China) and Its Changes Recorded after Removing the Source of Pollution","2021-09-14T10:50:15Z","c(""Li, X."", ""Ren, Yu."", ""Titlyanov, E. A."", ""Titlyanova, T. V."", ""Belous, O. S."", ""Guo, M."", ""Huang, H."")","Li, X.","c(""Cyanobacteria"", ""biomass"", ""fish farms"", ""flora"", ""macroalgae"", ""macrophytes"", ""pollution"", ""population density"", ""seawater"", ""species diversity"", ""wastewater"", ""China"")","2021 v.47 no.2","Russian journal of marine biology","The benthic flora off the Luhuitou Peninsula (Sanya Bay) was studied, for the first time, in areas located opposite a wastewater outlet from fish farm ponds and, thus, heavily polluted with nutrients (dissolved organic nitrogen (DIN), on average 30 μM; orthophosphates, 5.0 μM). Changes in the benthic flora were recorded before and after the farm stopped operation. It was shown that with a decrease in the concentration of nutrients in seawater (DIN, to 3 μM; orthophosphates, to 0.2 μM) the species diversity of macroalgae and cyanobacteria increased significantly over a year and a half, while the population density and biomass of macrophytes decreased. The values of all parameters of the studied flora in the previously heavily polluted areas became close to the average level for Sanya Bay.","2021-03","2021","7979-2021","1063-0740","article","no. 2","v. 47","105","113","8","pp. 105-113","http://dx.doi.org/10.1134/S1063074021020073","10.1134/S1063074021020073","Citation in PubAg","",NA,NA,NA,NA,NA,"NULL"
"7292901","7292901","Genome Analysis of Sable Fur Color Links a Lightened Pigmentation Phenotype to a Frameshift Variant in the Tyrosinase-Related Protein 1 Gene","2021-09-14T08:52:26Z","c(""Manakhov, Andrey D."", ""Mintseva, Maria Y."", ""Andreeva, Tatiana V."", ""Filimonov, Pavel A."", ""Onokhov, Alexey A."", ""Chernova, Irina E."", ""Kashtanov, Sergey N."", ""Rogaev, Evgeny I."")","Manakhov, Andrey D.","c(""Martes"", ""Russia"", ""chocolate"", ""color"", ""enzymes"", ""eumelanin"", ""farms"", ""fur"", ""genes"", ""phenotype"", ""pigmentation"", ""puppies"", ""sequence analysis"")","2021 v.12 no.2","Genes","Sable (Martes zibellina) is one of the most valuable species of fur animals. Wild-type sable fur color varies from sandy-yellow to black. Farm breeding and 90 years of directional selection have resulted in a generation of several sable breeds with a completely black coat color. In 2005, an unusually chocolate (pastel) puppy was born in the Puschkinsky State Fur Farm (Russia). We established that the pastel phenotype was inherited as a Mendelian autosomal recessive trait. We performed whole-genome sequencing of the sables with pastel fur color and identified a frameshift variant in the gene encoding membrane-bound tyrosinase-like enzyme (TYRP1). TYRP1 is involved in the stability of the tyrosinase enzyme and participates in the synthesis of eumelanin. These data represent the first reported variant linked to fur color in sables and reveal the molecular genetic basis for pastel color pigmentation. These data are also useful for tracking economically valuable fur traits in sable breeding programs.","2021-01-25","2021","7979-2021","2073-4425","article","no. 2","v. 12",NA,NA,NA,NA,"http://dx.doi.org/10.3390/genes12020157","10.3390/genes12020157","Citation in PubAg","",NA,NA,NA,NA,NA,"NULL"
"6529653","6529653","Conventionalization of Organic Farms in Germany: An Empirical Investigation Based on a Composite Indicator Approach","2021-09-13T23:20:32Z","c(""Seidel, Claudia"", ""Heckelei, Thomas"", ""Lakner, Sebastian"")","Seidel, Claudia","c(""agricultural law"", ""animal husbandry"", ""crop production"", ""farms"", ""monitoring"", ""organic production"", ""principal component analysis"", ""Germany"")","2019 v.11 no.10","Sustainability","The term &ldquo;conventionalization&rdquo; of organic agriculture was created to depict the controversially discussed phenomenon that organic agriculture departs from the core organic principles on which it is based. We present an empirical, index-based approach to investigate developments of organic farming practices towards conventionalization. An index of conventionalization can be used as a monitoring tool to support policymakers to further develop agricultural regulations. We calculate composite indicators for three farm types: farms specialized on crop production, farms specialized on animal husbandry, and mixed farms. Principal component analysis serves to derive objective weights based on the correlations between indicators which then allow a linear aggregation to the composite indicator. Results show that developments towards conventionalization of the whole organic farming sector cannot be detected for German farms between 2000 and 2009. Therefore, we do not see the necessity for changes in regulation of the organic sector with regard to conventionalization.","2019-05-23","2019","7981-2019","2071-1050","article","no. 10","v. 11",NA,NA,NA,NA,"http://dx.doi.org/10.3390/su11102934","10.3390/su11102934","Citation in PubAg","",NA,NA,NA,NA,NA,"NULL"
"7371801","7371801","An Exploratory Study of Occupational Safety and Health with Limited Resource African-American Farmers","2021-09-14T10:48:21Z","c(""Key, Corey D."", ""Wheat, John R."")","Key, Corey D.","c(""African Americans"", ""agricultural health and safety"", ""agromedicine"", ""capital"", ""equipment"", ""farmers"", ""farms"", ""health promotion"", ""land ownership"")","2021 v.26 no.2","Journal of agromedicine","Objectives: Limited resource African-American farmers exist at the nexus of several correlates of disparities (e.g., minority, poor, rural, and agricultural) and beyond the reach of most health promotion programs. Minimal research addresses their occupational safety and health. We proposed to explore such concerns with them. Methods: We conducted phenomenological interviews with nine farmers about work practices, farm operations, safety practices, health, and sources of information and assistance. We audio-recorded, transcribed, and analyzed interviews to code topics and identify themes. Results: The farmers varied in background, land ownership, farm products, and degree of resource limitation. We identified six themes: limited capital and sources of information, old unsafe machinery and equipment, a pragmatic resilient attitude, distrust of public institutions and agencies, lack of safety training useful on their farms, and personal health conditions. Conclusion: These themes raise hypotheses about limited resource African-American farmers’ experience with agricultural safety and health compounded by various economic, environmental, behavioral, social, and institutional determinants. We recommend that these hypotheses be pursued with effective community engagement and partnership to collect and interpret needed data from samples representative of the population of these farmers, including comparison with other limited resource farmer populations.","2021-04-03","2021","7979-2021","1545-0813","article","no. 2","v. 26","140","150","10","pp. 140-150","https://dx.doi.org/10.1080/1059924X.2020.1724842","10.1080/1059924X.2020.1724842","Citation in PubAg","",NA,NA,NA,NA,NA,"NULL"
"6717187","6717187","Optimizing wind farm layout by addressing energy-variance trade-off: A single-objective optimization approach","2021-09-14T02:49:38Z","c(""Wang, Longyan"", ""Zuo, Ming J."", ""Xu, Jian"", ""Zhou, Yunkai"", ""Tan, Andy C."")","Wang, Longyan","c(""confidence interval"", ""prediction"", ""uncertainty"", ""variance"", ""wind farms"", ""wind power"", ""wind turbines"")","2019 v.189","Energy","Wind farm layout optimization results depend on the optimization objectives, such as power output and variance. This paper investigates an alternative strategy for wind farm layout optimization by trading off the mean wind power output and power variance. Two optimization schemes, the weighted optimization and confidence interval optimization are compared in term of their performances on trading off energy-variance. For the weighted optimization, the objective function weight value α varies from 0 to 1 (implying the optimization objective shifts its weight from the power variance to the power output), while for the confidence interval (CI) optimization, either the lower or the upper limit of power output CI is maximized/minimized. It is found that the CI maximization achieves a trade-off of mean power output and power variance similar to the weighted optimization with α≥0.6, and the same individual power output range (192 kW–207 kW) is obtained with staggered placements of wind turbines. The CI minimization obtains a trade-off of average power output and power variance close to the weighted optimization with α≤0.4, and the optimal wind turbine locations are aligned. The advantage of CI optimization lies on its capability of predicting the power output uncertainty.","2019-12-15","2019","7981-2019","0360-5442","article",NA,"v. 189","116149",NA,NA,NA,"https://dx.doi.org/10.1016/j.energy.2019.116149","10.1016/j.energy.2019.116149","Citation in PubAg","",NA,NA,NA,NA,NA,"NULL"
