"id","agid","title","timestamp","author","author_primary","subject","source","journal","abstract","date","publication_year","publication_year_rev","issn","type","issue","volume","startpage","endpage","pageoffset","page","doi_url","doi","text_availability","language","chorus","pmid","pmid_url","pmcid","pmcid_url","files_ss"
"7130197","7130197","Colostrum supplementation with n-3 fatty acids does not alter calf outcome on a healthy commercial farm","2021-09-14T05:26:47Z","c(""Opgenorth, Julie"", ""Sordillo, Lorraine M."", ""Gandy, Jeffrey C."", ""VandeHaar, Michael J."")","Opgenorth, Julie","c(""alpha-tocopherol"", ""blood proteins"", ""calves"", ""cattle diseases"", ""colostrum"", ""commercial farms"", ""disease incidence"", ""fish oils"", ""gene expression"", ""genes"", ""heart"", ""heifers"", ""immune response"", ""inflammation"", ""interleukin-10"", ""interleukin-8"", ""leukocytes"", ""linseed oil"", ""lipopolysaccharides"", ""medical records"", ""milk replacer"", ""mortality"", ""omega-3 fatty acids"", ""oxidants"", ""oxidative stress"", ""prostaglandin synthase"", ""protein synthesis"", ""tumor necrosis factor-alpha"", ""weaning"")","2020 v.103 no.12","Journal of dairy science","Our objective was to supplement colostrum with n-3 fatty acids (FA) to provide anti-inflammatory mediators that may improve the immune response of neonatal calves. Elevated markers of inflammation have been associated with increased occurrence of calf disease in early life, thus decreasing animal productivity. We hypothesized that a colostrum supplement containing 60-mL of a 1:1 ratio fish:flaxseed oil blend with or without 200 mg of α-tocopherol might provide an advantageous start to early life by decreasing oxidative stress and regulating the inflammatory response. Calves were blocked by birth order and randomly assigned to 1 of 3 treatments: no supplement added to colostrum (control), 60 mL of 1:1 fish:flaxseed oil blend, and 60 mL of 1:1 fish:flaxseed oil blend with 200 mg of α-tocopherol. In total, 180 heifer calves (n = 60 per treatment) were enrolled on a commercial farm. After colostrum feeding, all calves were housed in individual hutches and fed milk replacer 3 times per day. Health was scored 3 times per week until weaning at 8 wk of age. Weight, wither height, and heart girth were measured after birth, 3 wk, and 8 wk of age to assess preweaning growth. A subgroup of 54 calves (18 blocks or 18 calves per treatment) were sampled 2 d (± 8 h) after birth to evaluate oxidant status, serum total protein, and inflammatory gene and cytokine protein expression in blood after an in vitro lipopolysaccharide (LPS) challenge as indicators of health and immunity. At 9 wk, calves were transported 18 h to another farm, and medical records were kept as an indicator of disease incidence up to 13 wk of age. Calf mortality was 1.8%, which is below industry average, and exceptional health scores were observed throughout the study. Health scores and growth were similar throughout the preweaning period regardless of treatment. Serum total protein indicated successful passive transfer in all calves, and oxidant status index was not affected by treatments on d 2 of age. Concentrations of tumor necrosis factor α increased with LPS stimulation, but the increase was not altered by treatment. Likewise, leukocyte gene expression of tumor necrosis factor α, IL-8 and IL-10, and cyclooxygenase-2 increased upon LPS stimulation, but the fold change did not differ with treatment. In conclusion, 60 mL of 1:1 ratio fish:flaxseed oil colostrum supplement did not enhance preweaning calf performance. Supplementing n-3 FA in a one-time meal may not provide the anti-inflammatory benefits observed with continuous feeding.","2020-12","2020","7980-2020","0022-0302","article","no. 12","v. 103","11689","11696","7","pp. 11689-11696","https://dx.doi.org/10.3168/jds.2019-18046","10.3168/jds.2019-18046","Citation in PubAg","",NA,NA,NA,NA,NA,"NULL"
"6841281","6841281","A farm-to-fork quantitative risk assessment model for Salmonella Heidelberg resistant to third-generation cephalosporins in broiler chickens in Canada","2021-09-14T05:03:32Z","c(""Collineau, Lucie"", ""Chapman, Brennan"", ""Bao, Xu"", ""Sivapathasundaram, Branavan"", ""Carson, Carolee A."", ""Fazil, Aamir"", ""Reid-Smith, Richard J."", ""Smith, Ben A."")","Collineau, Lucie","c(""Codex Alimentarius"", ""Salmonella Heidelberg"", ""antibiotic resistance"", ""broiler chickens"", ""ceftiofur"", ""chicken industry"", ""chicken meat"", ""cross contamination"", ""disinfection"", ""evisceration"", ""farm to fork"", ""farms"", ""flocks"", ""food industry"", ""guidelines"", ""human health"", ""humans"", ""ingestion"", ""microbiological risk assessment"", ""models"", ""monitoring"", ""poultry production"", ""public health"", ""quantitative risk assessment"", ""risk"", ""risk reduction"", ""temperature"", ""vaccination"", ""virulence"", 
""Canada"")","2020 v.330","International journal of food microbiology","Salmonella Heidelberg resistant to ceftiofur (a third-generation cephalosporin antimicrobial agent) in broiler chicken products pose a risk to public health in Canada. The objective of this study was to assess the extent of that risk and to evaluate the effect of intervention measures along the agri-food chain. A stochastic farm-to-fork quantitative microbial risk assessment model was developed following the Codex Alimentarius Guidelines for Risk Analysis of Foodborne Antimicrobial Resistance. Different scenarios were analyzed to assess the individual relative effects of 18 possible interventions in comparison to a baseline scenario. The baseline scenario represented the first year of on-farm antimicrobial use surveillance in the Canadian broiler industry and the year before an industry-imposed ban on the preventive use of antimicrobials of very high importance to human health (2013), where 31.3% of broiler flocks consisted of birds to which ceftiofur was administered.The baseline scenario predicted an average probability of illness of 1.1 per 100,000 servings (SE: 0.064 per 100,000), corresponding to an average of 22,000 human infections (SE: 1900) with ceftiofur-resistant S. Heidelberg per year, which is likely an overestimation. This risk was reduced by 90% or 20% when two separate scenarios designed to capture the effect of withdrawing preventive ceftiofur use from poultry production were simulated using different approaches; data used for the former scenario were confounded by other potential concomitant control measures (e.g. Salmonella vaccination programme), so the true effect likely lies somewhere between the two estimates. A theoretical ‘worst case’ scenario where all flocks had birds exposed to ceftiofur increased the risk by 107%. A 50% reduction in the probability of human prior exposure to antimicrobials, which has a selective and competitive effect for Salmonella spp. following ingestion of contaminated products, reduced the risk by 65%. Other promising measures that could be considered for further risk management included improved cleaning and disinfection between broiler flocks on farm (risk reduction by 26%), exclusive use of air chilling (risk reduction by 34%), and the improvement of meat storage and preparation conditions, e.g., no temperature abuse at retail (risk reduction by 88%). These findings showed the importance of a structured approach to assessing and potentially implementing effective interventions to reduce the risk associated with ceftiofur-resistant S. Heidelberg at different steps along the agri-food chain.Major data gaps included information on concentrations of resistant bacteria, cross contamination at processing and how ceftiofur-resistant S. Heidelberg behave in comparison with susceptible ones, e.g., in terms of growth and survival ability, as well as pathogenicity and virulence.","2020-10-02","2020","7980-2020","0168-1605","article",NA,"v. 330","108559",NA,NA,NA,"https://dx.doi.org/10.1016/j.ijfoodmicro.2020.108559","10.1016/j.ijfoodmicro.2020.108559","Citation in PubAg","",NA,NA,NA,NA,NA,"NULL"
"6724855","6724855","Examining U.S. grain marketing and farm supply cooperatives’ sustainable growth rates","2021-09-14T02:57:44Z","c(""Smart, Nathan"", ""Briggeman, Brian C."", ""Tack, Jesse"", ""Perry, Edward"")","Smart, Nathan","c(""cooperatives"", ""data collection"", ""farms"", ""profits and margins"", ""risk"", ""sales"", ""sustainable development"", ""United States"")","2019 v.35 no.4","Agribusiness","A challenge for many U.S. grain marketing and farm supply cooperatives is ensuring that exceptional growth rates are sustainable in the long run. Growing too rapidly can sacrifice financial soundness, causing a business to effectively grow broke. The objective of this study is to examine whether or not U.S. grain marketing and farm supply cooperatives are able to manage their recent growth. To do so, we apply the sustainable growth rate (SGR) and sustainable growth challenge (SGC) metrics to a unique panel data set of United States cooperatives. Examining the SGRs for these cooperatives suggests that positive net profit margins are key to positive growth. When actual growth exceeds sustainable growth, most cooperatives are able to rapidly alleviate this difference through increasing leverage or operational efficiency. However, some cooperatives face more persistent growth challenges and are thus the most at risk of growing broke. Large cooperatives and cooperatives more dependent on farm supply sales rely heavily on leverage for managing growth.","2019-10","2019","7981-2019","0742-4477","article","no. 4","v. 35","625","638","13","pp. 625-638","http://dx.doi.org/10.1002/agr.21609","10.1002/agr.21609","Citation in PubAg","",NA,NA,NA,NA,NA,"NULL"
"6493916","6493916","Trait-based evaluation of plant assemblages in traditional farm ponds in Korea: Ecological and management implications","2021-09-14T09:08:18Z","c(""YOON, Sungsoo"", ""KIM, GoWoon"", ""CHOI, Ho"", ""BYUN, Chaeho"", ""LEE, Dowon"")","YOON, Sungsoo","c(""agricultural land"", ""biodiversity conservation"", ""botanical composition"", ""drainage"", ""farm ponds"", ""farms"", ""irrigation"", ""land use"", ""landscapes"", ""multidimensional scaling"", ""nutrient content"", ""plant communities"", ""prediction"", ""sediments"", ""South Korea"")","2019 v.78 no.1","Journal of limnology","The Korean traditional farm pond called dumbeong is an important rural landscape element that supports local biodiversity and is useful in irrigating agricultural fields during dry periods. This study assesses how plant communities in dumbeongs respond to adjacent land use, water depth, open-water surface, and nutrient levels and irrigation usage. Plant functional and species groups, based on trait and species data respectively from 20 dumbeongs in Seocheon-gun, South Korea, were classified by hierarchical analysis and nonmetric multidimensional scaling. Relationships between the plant community composition and explanatory variables at both the species and functional group levels were tested through redundancy analysis. The results showed that irrigation usage prevented nutrient accumulation and water depth reduction of the ponds, and we found water depth was the only significant factor that determined plant composition at both species and functional group levels. The plant functional groups were more useful than plant species in predicting plant composition in dumbeongs, owing to their collective response to water depth and open-water surface. Our results demonstrate that management practices of dumbeong, such as periodic drainage, sediment removal and control of dominant plant species, alter its plant communities and thus need to be considered for biodiversity conservation in agricultural landscapes.","2019-01-03","2019","7981-2019","1129-5767","article","no. 1","v. 78",NA,NA,NA,NA,"http://dx.doi.org/10.4081/jlimnol.2019.1861","10.4081/jlimnol.2019.1861","Citation in PubAg","",NA,NA,NA,NA,NA,"NULL"
"7315235","7315235","The dynamics of rubber production in Malaysia: Potential impacts, challenges and proposed interventions","2021-09-14T09:25:27Z","c(""Ali, Muhammad Fadzli"", ""Akber, Md. Ali"", ""Smith, Carl"", ""Aziz, Ammar Abdul"")","Ali, Muhammad Fadzli","c(""compliance"", ""crop diversification"", ""farm income"", ""farms"", ""focus groups"", ""forest policy"", ""imports"", ""livelihood"", ""prices"", ""private sector"", ""profitability"", ""rubber"", ""rubber industry"", ""stakeholders"", ""supply chain"", ""world markets"", ""Malaysia"")","2021 v.127","Forest policy and economics","The rubber industry is one of the largest contributors to Malaysia's GDP and is economically important for the country. However, production has been declining over the last few decades. Similarly, this has also occurred in other crops such as cocoa. The decline in production adversely impacts the livelihood of local rubber smallholder farmers. To understand why this decline in rubber production has occurred, we used a systems thinking approach to analyze the underlying feedback mechanisms controlling rubber production. In addition to secondary data, we conducted focus group discussions and in-depth interviews with various actors and experts in the rubber supply chain across Peninsular Malaysia in order to develop a dynamic hypothesis that explains the decline in rubber production over time. Our analysis shows that feedback loops between global demand and supply, national rubber price, and smallholder farmer income determines rubber production at the local scale. In general, the lack of compliance and participation in the global exports restriction policy, insufficient national price incentives, and the absence of national import regulations have kept rubber prices low, leading to low profitability for smallholder farmers. This has caused smallholder farmers to reduce tapping activities and farm maintenance. Some have left rubber farming altogether. This has reduced rubber plantation area and rubber production. We propose several policy improvements to address the issue: (1) enhance the monitoring of rubber supply in the global market through international collaboration; (2) increase domestic rubber consumption through government projects and incentives and eventually follow this up with strict rubber import regulations; and (3) increase smallholder farmer income through the enhancement of government incentives and R&D, formation of co-operatives, application of crop diversification, and obtaining support from the private sector. The findings of this study are also applicable to other rubber-producing countries due to the similar dynamics that exist in the rubber production system globally. The approach adopted in this study can better facilitate engagement with rubber stakeholders, especially smallholder farmers, and inform the formulation of effective smallholder-oriented policies.","2021-06","2021","7979-2021","1389-9341","article",NA,"v. 127","102449",NA,NA,NA,"https://dx.doi.org/10.1016/j.forpol.2021.102449","10.1016/j.forpol.2021.102449","Citation in PubAg","",NA,NA,NA,NA,NA,"NULL"
"7086947","7086947","Molecular characterization of antimicrobial resistance genes on farms and in commercial milk with emphasis on the effect of currently practiced heat treatments on viable but nonculturable formation","2021-09-14T10:26:28Z","c(""Taher, Eman M."", ""Hemmatzadeh, Farhid"", ""Aly, Salwa A."", ""Elesswy, Hamdy A."", ""Petrovski, Kiro R."")","Taher, Eman M.","c(""UHT milk"", ""antibiotic resistance"", ""antibiotic resistance genes"", ""bacteria"", ""bulk milk"", ""farms"", ""food safety"", ""genomics"", ""horizontal gene transfer"", ""milk"", ""pasteurization"", ""pasteurized milk"")","2020 v.103 no.11","Journal of dairy science","Despite the considerable advances that have been made to improve dairy food safety, there is rising concern that pasteurization is not sufficient for the destruction of plasmid-mediated antimicrobial resistance (AMR) genes of resistant bacteria and could stimulate bacteria to enter into a viable but nonculturable (VBNC) state. In the current study, we surveyed the prevalence of 1 genomic and 9 plasmid-mediated AMR genes in 100 samples (bulk tank milk and milk filter socks) at the farm level and 152 commercial milk samples (pasteurized and UHT milks) and assessed the VBNC state in dairy bacteria. Results revealed that sul2 was the most prevalent plasmid-mediated gene in milk filter socks (96%), bulk tank milk (48%), pasteurized milk (68%), and UHT (43%) milk; in contrast, mecA was not detected in any sample. Additionally, commercial pasteurization (as currently practiced) failed to decrease the prevalence of the blaTEM₋B₁ (43%), tetK (30%), and tetA (55%) plasmid-mediated AMR genes; thus, commercial pasteurization may be one of the factors creating the VBNC state in some dairy bacteria. Continued research is necessary to identify bacterial species entering the VBNC state after pasteurization, to assess their potential hazard level and shed more light on the expression and possibility of horizontal gene transfer of those plasmid-mediated AMR genes.","2020-11","2020","7980-2020","0022-0302","article","no. 11","v. 103","9936","9945","9","pp. 9936-9945","https://dx.doi.org/10.3168/jds.2020-18631","10.3168/jds.2020-18631","Citation in PubAg","",NA,NA,NA,NA,NA,"NULL"
"6853772","6853772","Structure of benthic macroinvertebrates population in an area of Mopoyem Bay (Ebrie Lagoon, Côte d’Ivoire) exposed to the discharge of a fish farm effluents","2021-09-14T05:17:04Z","c(""Yoboué, Kouamé Parfait"", ""Ouattara, Nahoua Issa"", ""Berté, Siaka"", ""Aboua, Benié Rose Danielle"", ""Coulibaly, Julien Kalpy"", ""Kouamélan, Essetchi Paul"")","Yoboué, Kouamé Parfait","c(""anthropogenic activities"", ""aquatic environment"", ""benthic organisms"", ""biodiversity"", ""dry season"", ""effluents"", ""fish culture"", ""fish farms"", ""macroinvertebrates"", ""seasonal variation"", ""water management"", ""wet season"", ""Cote d'Ivoire"")","2020 v.192 no.4","Environmental monitoring and assessment","Discharges of untreated effluent from fish farming into the aquatic environment are a practice that can affect local biodiversity. This study was conducted to characterize, in the Ebrie Lagoon, the structure of benthic macroinvertebrates inhabiting an environment exposed to effluent discharges from fish farms. The benthic macroinvertebrates were collected with a Van Veen grab seasonally between August 2016 and July 2017 at the effluent discharge point in the lagoon and at a reference station out of anthropogenic activities. Identification of organisms was done using specialized keys. The results revealed that the proportion of tolerant macroinvertebrates is relatively high (47.74%) at the point of discharge of fish farming effluents into the Ebrie Lagoon. While at the reference station, macroinvertebrates population is dominated by sensitive and medium-sensitive taxa (93.53%). The benthic macroinvertebrates population, influenced by seasonal variations, exhibits peaks of abundance and diversity during the rainy seasons, while during the dry seasons, they strongly decline. Fish farming effluents dumped in Ebrie Lagoon lead to structural modifications of the local benthic macroinvertebrates population. These disturbances are intensified in dry seasons and attenuated in rainy seasons. This information should be taken into account in any decision to promote the responsible practice of fish farming and the sustainable management of water resources exploited for fish farming purposes.","2020-04","2020","7980-2020","0167-6369","article","no. 4","v. 192","203","203","1","pp. 203-203","https://dx.doi.org/10.1007/s10661-020-8167-8","10.1007/s10661-020-8167-8","Citation in PubAg","",NA,NA,NA,NA,NA,"NULL"
"6717433","6717433","Animal welfare and microbiological safety of poultry meat: Impact of different at-farm animal welfare levels on at-slaughterhouse Campylobacter and Salmonella contamination","2021-09-14T02:49:49Z","c(""Iannetti, Luigi"", ""Neri, Diana"", ""Santarelli, Gino Angelo"", ""Cotturone, Giuseppe"", ""Podaliri Vulpiani, Michele"", ""Salini, Romolo"", ""Antoci, Salvatore"", ""Di Serafino, Gabriella"", ""Di Giannatale, Elisabetta"", ""Pomilio, Francesco"", ""Messori, Stefano"")","Iannetti, Luigi","c(""Campylobacter coli"", ""Campylobacter jejuni"", ""Salmonella Bredeney"", ""Salmonella Infantis"", ""animal welfare"", ""broiler chickens"", ""cecum"", ""chicken carcasses"", ""ethics"", ""farms"", ""feces"", ""flocks"", ""microbiological quality"", ""neck"", ""poultry meat"", ""serotypes"", ""slaughter"", ""slaughterhouses"")","2020 v.109","Food control","Stress factors and poor animal welfare can increase the susceptibility of food-producing animals to diseases, posing microbial risks to consumers. Animal welfare levels, objectively measured with the application of the Welfare Quality® protocol, were assessed in thirteen broiler flocks, including organic ones, to evaluate the presence of statistically significant differences in relation to Campylobacter and Salmonella faecal shedding and consequent microbiological contamination of broiler carcases at slaughterhouse. Each flock underwent animal welfare evaluation the day before slaughtering, followed by Campylobacter and Salmonella detection in faeces (caecal content) and neck skin at slaughterhouse. A total of 1040 samples (520 caecal contents; 520 neck skins) were included in the study. Campylobacter enumeration and Salmonella serotyping were also carried out. The highest welfare scores were reported in organic flocks. Significantly lower Campylobacter concentrations both in caecal content and neck skins (P < 0.05) were reported in organic batches, compared to high welfare conventional batches. Low-welfare batches showed higher prevalence of Salmonella both in neck skins and caecal content, with a statistically significant difference compared to high-welfare batches (43.6% versus 2.9% in neck skins; 19.3% versus 0% in caecal content; P < 0.00001). Salmonella Infantis and Salmonella Bredeney were the most common serotypes, while Campylobacter jejuni and Campylobacter coli were the detected species.This study provides new evidence that high animal welfare standards at farms, other than an ethical issue and a value-add for the end product, could also improve the microbiological safety of poultry meat, ultimately contributing to the protection of consumers.","2020-03","2020","7980-2020","0956-7135","article",NA,"v. 109","106921",NA,NA,NA,"https://dx.doi.org/10.1016/j.foodcont.2019.106921","10.1016/j.foodcont.2019.106921","Citation in PubAg","",NA,NA,NA,NA,NA,"NULL"
