"id","agid","title","timestamp","author","author_primary","subject","source","journal","abstract","date","publication_year","publication_year_rev","issn","type","issue","volume","startpage","endpage","pageoffset","page","doi_url","doi","text_availability","language","chorus","pmid","pmid_url","pmcid","pmcid_url","files_ss"
"7330339","7330339","The effect of antimicrobial treatment on mortality associated with urinary tract disease in mink kits (Neovison vison)","2021-09-14T09:47:43Z","c(""Mundbjerg, Karin"", ""Pedersen, Peder Elbek"", ""Hammer, Anne Sofie"")","Mundbjerg, Karin","c(""Neovison vison"", ""amoxicillin"", ""cystitis"", ""farms"", ""flocks"", ""mink"", ""mortality"", ""sulfadiazine"", ""therapeutics"", ""trimethoprim"", ""urolithiasis"", ""weight gain"")","2021 v.63 no.1","Acta veterinaria scandinavica","Mink urinary tract disease (MUTD) often presents as urolithiasis and/or cystitis and is known as an important cause of mortality in mink kits during the early growth season. Antimicrobial flock treatment has been routinely applied as preventive/therapeutic protocol on Danish mink farms with increased mortality associated with MUTD. The therapeutic effect of this treatment strategy has not previously been investigated. In this study, we applied controlled parallel group treatment trials to assess the effect of sulfadiazine/trimethoprim and amoxicillin treatment on mortality associated with MUTD in mink kits. On farm A, eight mink kits were diagnosed with MUTD post mortem in the treatment group (n = 1920, sulfadiazine/trimethoprim treatment: 30 mg/kg, q 24 h, P.O for 5 days) compared to 16 in the untreated control group (n = 1920). No significant difference in mortality associated with MUTD were found between the treatment and the control group using the Fisher’s exact test (P = 0.15). Treatment group 2 (n = 1920, amoxicillin treatment: 14 mg/kg q 24 h, P.O for 5 days) and treatment group 3 (n = 2088, amoxicillin treatment: 7.5 mg/kg q 24 h, P.O for 5 days) were investigated on farm B. Eight and four mink kits were diagnosed with MUTD post mortem in group 2 and 3, respectively. No difference between occurrence of MUTD were found between the control group and treatment group 2 (P = 0.42) or treatment group 3 (P = 0.75). No significant difference between final body weights or weight gain were found between treatment and control weighing groups on farm A or B. In conclusion, antimicrobial treatment administered in the feed showed no significant effect on weight gain or mortality associated with MUTD on the farms included in this study.","2021-12","2021","7979-2021","1751-0147","article","no. 1","v. 63","15","15","1","pp. 15-15","https://dx.doi.org/10.1186/s13028-021-00581-3","10.1186/s13028-021-00581-3","Citation in PubAg","",NA,NA,NA,NA,NA,"NULL"
"6195567","6195567","Microgreens—A review of food safety considerations along the farm to fork continuum","2021-09-14T05:11:13Z","c(""Riggio, Gina M."", ""Wang, Qing"", ""Kniel, Kalmia E."", ""Gibson, Kristen E."")","Riggio, Gina M.","c(""farm to fork"", ""food safety"", ""good agricultural practices"", ""industry"", ""microgreens"", ""pathogens"", ""risk"", ""salads"")","2019 v.290","International journal of food microbiology","The food safety implications of microgreens, an emerging salad crop, have been studied only minimally. The farm to fork continuum of microgreens and sprouts has some overlap in terms of production, physical characteristics, and consumption. This review describes the food safety risk of microgreens as compared to sprouts, potential control points for microgreen production, what is known to date about pathogen transfer in the microgreen production environment, and where microgreens differ from sprouts and their mature vegetable counterparts. The synthesis of published research to date may help to inform Good Agricultural Practices (GAPs) and Good Handling Practices (GHPs) for the emerging microgreen industry.","2019-02-02","2019","7981-2019","0168-1605","article",NA,"v. 290","76","85","9","pp. 76-85","https://dx.doi.org/10.1016/j.ijfoodmicro.2018.09.027","10.1016/j.ijfoodmicro.2018.09.027","Citation in PubAg","","10.1016/j.ijfoodmicro.2018.09.027",NA,NA,NA,NA,"NULL"
"6364688","6364688","A case study of transitions in farming and farm labor in southwestern Idaho","2021-09-14T09:01:25Z","c(""Meierotto, Lisa"", ""Som Castellano, Rebecca L."")","Meierotto, Lisa","c(""Cannabis sativa"", ""beers"", ""case studies"", ""farm labor"", ""feminization"", ""hops"", ""women"", ""Idaho"")","2019 v.8 no.4","Journal of agriculture, food systems, and community development","Farm labor in the U.S. is undergoing significant transitions. First, fewer farmworkers are migrating in the traditional sense, and more are settling in to rural American communities. Second, more women are working in agriculture-a process referred to as the feminization of agriculture. Third, there has been an increase in so-called “recreational” crops” like marijuana and hops grown for craft microbrew beers. This paper discusses these three transitions in Southwestern Idaho. These transitions were observed during pilot research conducted in Idaho during 2017–2018. We present this paper as a case study of current transitions in American agriculture.","2019","2019","7981-2019","2152-0801","article","no. 4","v. 8","111","123","12","pp. 111-123","http://dx.doi.org/10.5304/jafscd.2019.084.008","10.5304/jafscd.2019.084.008","Citation in PubAg","",NA,NA,NA,NA,NA,"NULL"
"6287307","6287307","On-farm pig dispatch methods and stockpeople attitudes on their use","2021-09-14T07:10:49Z","c(""Dalla Costa, Filipe Antonio"", ""Gibson, Troy John"", ""Oliveira, Steffan Edward Octávio"", ""Gregory, Neville George"", ""Coldebella, Arlei"", ""Faucitano, Luigi"", ""Dalla Costa, Osmar Antonio"")","Dalla Costa, Filipe Antonio","c(""anesthetics"", ""animal welfare"", ""attitudes and opinions"", ""farms"", ""livestock and meat industry"", ""surveys"", ""swine"")","2019 v.221","Livestock science","This study surveyed the on-farm dispatching methods used at pig farms, the characteristics of stockpeople operating them, in terms of training and management, and their opinions and attitudes about the efficiency and safety of the applied procedures. Independently of the pig type, the most used dispatching methods at the surveyed Brazilian farms were concussion (90%) and electrocution (5%). Both methods were reported as being efficient and safe for on-farm pig dispatching by most stockpeople (83%). However, 33% of all stockpeople reported they would prefer to use alternative methods, i.e., anesthetics (23%) or electrocution (32%). Only 7% of the stockpeople received training resulting in a more efficient application of the method (P < 0.05). Most stockpeople (96%) declared to feel uncomfortable with the dispatching procedure they use. This discomfort lasted for half a day or longer in 22% of them. The results of this survey suggest that the application of dispatching methods at pig farms may result in animal welfare issues related to the effectiveness of the methods and the attitudes of stockpeople.","2019-03","2019","7981-2019","1871-1413","article",NA,"v. 221","1","5","4","pp. 1-5","https://dx.doi.org/10.1016/j.livsci.2019.01.007","10.1016/j.livsci.2019.01.007","Citation in PubAg","",NA,NA,NA,NA,NA,"NULL"
"6497094","6497094","Integrated Pest Management (IPM) for Small-Scale Farms in Developed Economies: Challenges and Opportunities","2021-09-14T09:10:54Z","Grasswitz, Tessa  R.","Grasswitz, Tessa  R.","c(""biodiversity"", ""cost effectiveness"", ""food security"", ""integrated pest management"", ""outreach"", ""small farms"", ""Europe"", ""United States"")","2019 v.10 no.6","Insects","Small-scale farms are an important component of agricultural production even in developed economies, and have an acknowledged role in providing other biological and societal benefits, including the conservation of agricultural biodiversity and enhancement of local food security. Despite this, the small-farm sector is currently underserved in relation to the development and implementation of scale-appropriate Integrated Pest Management (IPM) practices that could help increase such benefits. This review details some of the characteristics of the small farm sectors in developed economies (with an emphasis on the USA and Europe), and identifies some of the characteristics of small farms and their operators that may favor the implementation of IPM. Some of the challenges and opportunities associated with increasing the uptake of IPM in the small-farm sector are discussed. For example, while some IPM tactics are equally applicable to virtually any scale of production, there are others that may be easier (or more cost-effective) to implement on a smaller scale. Conversely, there are approaches that have not been widely applied in small-scale production, but which nevertheless have potential for use in this sector. Examples of such tactics are discussed. Knowledge gaps and opportunities for increasing IPM outreach to small-scale producers are also identified.","2019-06-21","2019","7981-2019","2075-4450","article","no. 6","v. 10",NA,NA,NA,NA,"http://dx.doi.org/10.3390/insects10060179","10.3390/insects10060179","Full Text","",NA,"31234382","http://www.ncbi.nlm.nih.gov/pubmed/?term=31234382","PMC6628405","http://ncbi.nlm.nih.gov/pmc/articles/PMC6628405","{""dsId"":""PMCID_PDF"",""order"":""0"",""title"":""http://ncbi.nlm.nih.gov/pmc/articles/PMC6628405"",""label"":""PubMed Central""}"
"6812217","6812217","To Risk or Not to Risk? Risk Management and Farm Productivity","2021-09-14T04:33:20Z","c(""Vigani, Mauro"", ""Kathage, Jonas"")","Vigani, Mauro","c(""farming systems"", ""farms"", ""issues and policy"", ""production costs"", ""regression analysis"", ""risk"", ""risk management"", ""surveys"")","2019 v.101 no.5","American journal of agricultural economics","The impact of risk management on farm productivity is still being debated. Using survey data from French and Hungarian farms, we estimate the impacts of different risk management strategies and portfolios under varying levels of risk on total factor productivity. Results from a multinomial endogenous switching regression model show that the impacts can be positive or negative, depending on the risk management strategies adopted, the structure of the farming system, and the probability of risks. The choice of risk management strategies influences the farm's production costs and the allocation of resources. More complex risk management portfolios tend to have larger negative productivity impacts due to higher costs and the larger amount of resources subtracted from the production activity. Our results have important implications for risk management policies.","2019-10","2019","7981-2019","0002-9092","article","no. 5","v. 101","1432","1454","22","pp. 1432-1454","http://dx.doi.org/10.1093/ajae/aaz020","10.1093/ajae/aaz020","Citation in PubAg","",NA,NA,NA,NA,NA,"NULL"
"7325488","7325488","A cross‐sectional study of hard ticks (acari: ixodidae) on horse farms to assess the risk factors associated with tick‐borne diseases","2021-09-14T09:41:17Z","c(""Kamran, Kashif"", ""Ali, Abid"", ""Villagra, Cristian"", ""Siddiqui, Saima"", ""Alouffi, Abdulaziz S."", ""Iqbal, Asim"")","Kamran, Kashif","c(""Protozoa"", ""cross-sectional studies"", ""horses"", ""public health"", ""questionnaires"", ""risk assessment"", ""surveys"", ""ticks"", ""zoonoses"")","2021 v.68 no.3","Zoonoses and public health","Zoonotic diseases are significant public health issues. There is an urgent need to focus our efforts on the development of strategies that prevent and control potential arthropod vector‐borne pathogens. Hard ticks transmit a variety of viral, bacterial and protozoan pathogens to their vertebrate hosts. This is becoming of more concern, as anthropogenic alterations of the environment may unleash the spread of tick‐borne diseases throughout the world. Developing countries that are highly dependent on the livestock economy are a hot spot for tick‐borne infectious diseases. In this work, through a cross‐sectional approach that included a bibliographic survey, field collection and epidemiological questionnaire, we identified five tick species that were found to parasitize equines and transmit tick‐borne pathogens. Our data revealed a gap in fundamental knowledge of ticks and tick‐borne infectious diseases among equine breeders and owners. This article highlights the relevant risk factors that were found and the urgent actions that are needed to prevent the wide spread of hard ticks and their associated zoonotic diseases.","2021-05","2021","7979-2021","1863-1959","article","no. 3","v. 68","247","262","15","pp. 247-262","http://dx.doi.org/10.1111/zph.12809","10.1111/zph.12809","Citation in PubAg","",NA,NA,NA,NA,NA,"NULL"
"7312755","7312755","Soil disturbance levels, soil water content and the establishment of rainfed chickpea: Mechanised seeding options for smallholder farms in north‐west Bangladesh","2021-09-14T09:22:18Z","c(""Vance, Wendy H."", ""Bell, Richard W."", ""Johansen, Chris"", ""Haque, M. Enamul"", ""Musa, Abu M."", ""Shahidullah, Abul K. M."")","Vance, Wendy H.","c(""agronomy"", ""chickpeas"", ""disturbed soils"", ""field capacity"", ""furrows"", ""grain yield"", ""mechanization"", ""no-tillage"", ""plant establishment"", ""rain"", ""root growth"", ""seedbeds"", ""silt loam soils"", ""soil profiles"", ""soil strength"", ""soil water"", ""topsoil"", ""vigor"", ""volumetric water content"", ""water uptake"", ""Bangladesh"")","2021 v.207 no.2","Journal of agronomy and crop science","Optimum soil physical conditions for crop establishment are more likely to occur with mechanised row‐sowing using metered seeding and controlled depth placement of seeds than with broadcast sowing, that is common in many traditional South Asian cropping practices. Establishment success is a limitation for post‐rice crops in medium to heavy textured soils in the Eastern Gangetic Plain because sowing coincides with rapid topsoil drying and increases in soil strength. In addition, due to lack of rainfall in the post‐rice season the crop relies on access to stored soil water during vegetative and reproductive growth to achieve adequate yields. Our aim was to determine whether decreased soil disturbance (from full tillage to zero tillage (ZT) to undisturbed soil (Fallow)) and direct seeding (using small‐scale seeders) could 1) enhance chickpea crop establishment by conserving seedbed soil water and 2) alter crop water use of the water stored in the soil profile. The silt loam soil has an estimated volumetric soil water content (θv) of 34% at field capacity. At sowing, θv in the seedbed was between 25% to 29%. This was adequate for successful chickpea crop establishment, but slightly wetter than optimum for tillage. In the wet soil at sowing, there was evidence of smeared furrow walls and poor soil covering of the seed in the seedbed in strip planting (SP; rotating blades in front of tine) and ZT. Uncovered furrows (in ZT; using a tine opener) and the fallow soil lost more surface soil water (9%, 23 days after sowing) than the seedbeds created with greater levels of soil disturbance. In 2008, grain yield of single‐pass shallow tillage (SPST) was greater than SP but in 2009, grain yields of all one‐pass tillage techniques (ZT, SP, SPST) were greater than in the broadcast seeding in fully tilled soils. The improvement in chickpea yields was attributed to greater plant numbers, early plant vigour and root growth. Chickpea roots were found to 60 cm depth in the soil profile, and soil water content was less than the θv of wilting point to this depth at podding. There is evidence that root growth and plant water uptake occur deeper in these soil profiles to achieve the grain yields > 1,000 kg/ha recorded in this study. Mechanised sowing in rows with small‐scale seeders has the capability to overcome establishment and yield limitations for chickpea on medium to heavy soils in the post‐rice season.","2021-04","2021","7979-2021","0931-2250","article","no. 2","v. 207","208","223","15","pp. 208-223","http://dx.doi.org/10.1111/jac.12455","10.1111/jac.12455","Citation in PubAg","",NA,NA,NA,NA,NA,"NULL"
"7261192","7261192","Characterization of Non-O157 Shiga Toxin-Producing Escherichia coli Cultured from Cattle Farms in Xinjiang Uygur Autonomous Region, China, During 2016–2017","2021-09-14T08:06:10Z","c(""Su, Zhanqiang"", ""Zhang, Ling"", ""Sun, Honghu"", ""Hu, Ying"", ""Fanning, Séamus"", ""Du, Pengcheng"", ""Cui, Shenghui"", ""Bai, Li"")","Su, Zhanqiang","c(""Shiga toxin-producing Escherichia coli"", ""beef"", ""beef cattle"", ""computer simulation"", ""dairy cattle"", ""genetic variation"", ""humans"", ""multilocus sequence typing"", ""prevalence"", ""pulsed-field gel electrophoresis"", ""serotypes"", ""virulence"", ""China"")","2021","Foodborne pathogens & disease","Most outbreaks of Shiga toxin–producing Escherichia coli (STEC) are attributed to consumption of contaminated foodstuffs including beef and dairy products. In this study, we evaluated the prevalence of non-O157 STEC cultured from beef and dairy cattle and collected in Xinjiang Uygur Autonomous Region in China. Results identified 67 non-O157 STEC recovered from the 793 samples including beef cattle (10.28%, 43/418) and dairy cattle (6.40%, 24/375). A total of 67 non-O157 STEC was sequenced allowing for in silico analyses of their serotypes, virulence genes, and identification of the corresponding multilocus sequence types (STs). Twenty-one O serogroups and nine H serotypes were identified and the dominant serotype identified was O22:H8. One stx1 subtype (stx1a) and four stx2 subtypes (2a, 2b, 2c, and 2d) were found in the 67 non-O157 STEC isolates. The results revealed that stx1a+stx2a-positive STEC isolates were predominant (32.83%, 22/67), followed by stx1a+stx2d (29.85%, 20/67) and stx2a alone (17.91%, 12/67). Non-O157 STEC isolates carried virulence genes ehxA (98.51%), subA (53.73%), and cdtB (17.91%). Of the four adherence-associated genes tested, eaeA was absent, whereas lpfA and iha were present in 67 and 55 non-O157 STEC isolates, respectively. The STEC isolates were divided into 48 pulsed-field gel electrophoresis patterns and 10 STs, and ST446 (O22:H8) was the dominant clone (22.38%). Our results revealed that there was a high genetic diversity among non-O157 STEC isolated from beef and dairy cattle, some of which have potential to cause human diseases.","2021-02-01","2021","7979-2021","1556-7125","article",NA,NA,NA,NA,NA,NA,"http://dx.doi.org/10.1089/fpd.2020.2843","10.1089/fpd.2020.2843","Citation in PubAg","",NA,NA,NA,NA,NA,"NULL"
"7185446","7185446","Long-rains crops, short-rains crops, permanent crops and fruit crops: The ‘hidden’ multiple season-cropping system for adaptation to rain variability by smallholder farms","2021-09-14T06:27:26Z","c(""Tibesigwa, Byela"", ""Ntuli, Herbert"", ""Lokina, Razack"", ""Okumu, Boscow"", ""Komba, Coretha"")","Tibesigwa, Byela","c(""climate change"", ""environmental management"", ""fruits"", ""income"", ""rain"", ""uncertainty"", ""Sub-Saharan Africa"")","2021 v.278","Journal of environmental management","To adapt is to survive. However, sub-Saharan Africa, although highly dependent on agriculture, is vulnerable, most affected, with low-adaptive capacity. Luckily, the region is blessed with inherent adaptation-related strengths that are within reach, to counteract uncertainty in climatic patterns which are expected to continue well into the future. One such strength is a bimodal rainfall pattern that avails the ‘hidden’ multiple season-cropping systems that have the potential to produce four types of crops in a single plot in a single year: short-rains crops, long-rains crops, permanent crops and fruit crops. Despite burgeoning literature on adaptation, the impact of multiple season-cropping systems has not been adequately investigated. This study applies a novel approach to measure its impact on productivity of more than 10,000 smallholder plots using an endogenous switching regression framework. The study finds that plots that adopt multiple season-cropping systems produce higher quantities, earn more crop revenue, and are less likely to be affected by rainfall variability in comparison to plots that engage in single season-cropping systems. As the fight against climate change continues, there is need to move the needle on adaptation and consider strategies that are within reach. The multiple season-cropping systems provide this opportunity and emphasises the benefit of engaging in agriculture throughout the year and producing long-rains, short rains, permanent and fruits crops.","2021-01-15","2021","7979-2021","0301-4797","article",NA,"v. 278","111407",NA,NA,NA,"https://dx.doi.org/10.1016/j.jenvman.2020.111407","10.1016/j.jenvman.2020.111407","Citation in PubAg","",NA,NA,NA,NA,NA,"NULL"
"5958849","5958849","Resilience of Farm Women Working the Third Shift","2018-09-27T03:39:39Z","c(""Elliot, Valerie"", ""Hagel, Louise"", ""Dosman, James A."", ""Rana, Masud"", ""Lawson, Josh"", ""Marlenga, Barbara"", ""Trask, Catherine"", ""Pickett, William"")","Elliot, Valerie","c(""beef cattle"", ""cattle production"", ""comorbidity"", ""education"", ""epidemiological studies"", ""farm labor"", ""farms"", ""health status"", ""homemakers"", ""off-farm employment"", ""regression analysis"", ""women"", ""work schedules"", ""Saskatchewan"")","2018 v.23 no.1","Journal of agromedicine","Background: We examined physical health and work experiences in a Saskatchewan population of farm women, and determined how participation in the “third shift” (a phenomenon where women engage in off-farm employment, farm labor, and as homemakers) relates to their demographic, physical health, and work experiences. Materials and Methods: This is a cross-sectional epidemiological study. Reports from 980 women who lived or worked on Saskatchewan farms were analyzed to describe their health status, comorbidities, use of medications, and exposures to farm work. Regression models were used to explore determinants of participation in the third shift. Results: Two hundred and sixteen were women [22.0%] engaged in the “third shift”, and these women consistently reported significantly longer mechanized and non-mechanized farm work hours. Compared to women not involved in the third shift, participants in the third shift were more likely to be: 41–50 years of age [ORAdⱼ 2.06 (1.12, 3.77)], and involved in beef cattle production [ORAdⱼ 1.62 (1.05–2.49)], large animal chores [ORAdⱼ 1.66 (1.04–2.66)], use of shovels/pitchforks [ORAdⱼ 1.67 (1.08–2.57)], combine operation [ORAdⱼ 1.72 (1.08–2.74)], and have higher levels of education [e.g., ORAdⱼ 0.46 (0.29–0.72) for high school or less]. Descriptively, reduced engagement in the third shift was associated with “fair or poor” health status [ORCᵣᵤdₑ 0.32 (0.14–0.76)] and more co-morbidities [e.g., ORCᵣᵤdₑ 0.50 (0.33, 0.75) for 2 or more versus none reported]. Conclusion: This study found that farm women often report high levels of work, including engagement in the third shift. Women engaged in the third shift are also generally healthier than non-engaged women, consistent with a healthy worker effect.","2018-01-02","2018","7982-2018","1545-0813","article","no. 1","v. 23","70","77","7","pp. 8-77","http://dx.doi.org/10.1080/1059924X.2017.1384421","10.1080/1059924X.2017.1384421","Citation in PubAg","",NA,NA,NA,NA,NA,"NULL"
"6339696","6339696","The importance of non-farm livelihoods for household food security and dietary diversity in rural Myanmar","2021-09-14T08:23:53Z","c(""Pritchard, Bill"", ""Rammohan, Anu"", ""Vicol, Mark"")","Pritchard, Bill","c(""arable soils"", ""assets"", ""farms"", ""food security"", ""household surveys"", ""households"", ""livelihood"", ""nutritional adequacy"", ""socioeconomics"", ""Myanmar"")","2019 v.67","Journal of rural studies","Recent processes of socio-economic change in rural Myanmar are etching significant shifts to the social distribution of advantage and disadvantage, with implications for patterns of food security and dietary quality. This paper uses original repeat cross-sectional household survey data to identify emergent relationships between land and livelihoods on the one hand, and food security and dietary quality, on the other. The paper concludes that although land ‘matters’ (landholding households are more likely to be food secure and have higher dietary diversity than landless households), this association is strongly conditioned by livelihood and seasonal circumstances. Households with livelihood arrangements articulated to the non-farm economy, whether they were landholders or landless, exhibited superior food and nutritional outcomes compared to those with livelihoods only in farming. Hence, while access to arable land remains an important factor in shaping food security and dietary diversity, of greater importance is the capacity for households to supplement their land assets with livelihood activities in the non-farm economy. This finding reinforces broader arguments that emphasise the importance of the non-farm economy as a vital shaper of wellbeing for rural households in the global South.","2019-04","2019","7981-2019","0743-0167","article",NA,"v. 67","89","100","11","pp. 89-100","https://dx.doi.org/10.1016/j.jrurstud.2019.02.017","10.1016/j.jrurstud.2019.02.017","Citation in PubAg","",NA,NA,NA,NA,NA,"NULL"
